title,isbn,pageCount,publishedDate,thumbnailUrl,shortDescription,longDescription,status,authors,categories
Unlocking Android,1933988673,416.0,2009-04-01 07:00:00+00:00,https://s3.amazonaws.com/AKIAJC5RLADLUMVRPFDQ.book-thumb-images/ableson.jpg,"Unlocking Android: A Developer's Guide provides concise, hands-on instruction for the Android operating system and development tools. This book teaches important architectural concepts in a straightforward writing style and builds on this with practical and useful examples throughout.","Android is an open source mobile phone platform based on the Linux operating system and developed by the Open Handset Alliance, a consortium of over 30 hardware, software and telecom companies that focus on open standards for mobile devices. Led by search giant, Google, Android is designed to deliver a better and more open and cost effective mobile experience.    Unlocking Android: A Developer's Guide provides concise, hands-on instruction for the Android operating system and development tools. This book teaches important architectural concepts in a straightforward writing style and builds on this with practical and useful examples throughout. Based on his mobile development experience and his deep knowledge of the arcane Android technical documentation, the author conveys the know-how you need to develop practical applications that build upon or replace any of Androids features, however small.    Unlocking Android: A Developer's Guide prepares the reader to embrace the platform in easy-to-understand language and builds on this foundation with re-usable Java code examples. It is ideal for corporate and hobbyists alike who have an interest, or a mandate, to deliver software functionality for cell phones.    WHAT'S INSIDE:        * Android's place in the market      * Using the Eclipse environment for Android development      * The Intents - how and why they are used      * Application classes:            o Activity            o Service            o IntentReceiver       * User interface design      * Using the ContentProvider to manage data      * Persisting data with the SQLite database      * Networking examples      * Telephony applications      * Notification methods      * OpenGL, animation & multimedia      * Sample Applications  ",PUBLISH,"w. frank ableson, charlie collins, robi sen","open source, mobile"
"Android In Action, Second Edition",1935182722,592.0,2011-01-14 08:00:00+00:00,https://s3.amazonaws.com/AKIAJC5RLADLUMVRPFDQ.book-thumb-images/ableson2.jpg,"""Android in Action, Second Edition is a comprehensive tutorial for Android developers. Taking you far beyond """"Hello Android",""""" this fast-paced book puts you in the driver's seat as you learn important architectural concepts and implementation strategies. You'll master the SDK",desconocido,"and even learn to extend or replace android's built-in features by building useful and intriguing examples. ""","""when it comes to mobile apps, android can do almost anything and with this book, so can you! android runs on mobile devices ranging from smart phones to tablets to countless special-purpose gadgets. it's the broadest mobile platform available. android in action, second edition is a comprehensive tutorial for android developers. taking you far beyond """"hello android"
Specification By Example,1617290084,0.0,2011-06-03 07:00:00+00:00,https://s3.amazonaws.com/AKIAJC5RLADLUMVRPFDQ.book-thumb-images/adzic.jpg,No description available,No description available,PUBLISH,gojko adzic,software engineering
Flex 3 In Action,1933988746,576.0,2009-02-02 08:00:00+00:00,https://s3.amazonaws.com/AKIAJC5RLADLUMVRPFDQ.book-thumb-images/ahmed.jpg,No description available,"New web applications require engaging user-friendly interfaces   and the cooler, the better. With Flex 3, web developers at any skill level can create high-quality, effective, and interactive Rich Internet Applications (RIAs) quickly and easily. Flex removes the complexity barrier from RIA development by offering sophisticated tools and a straightforward programming language so you can focus on what you want to do instead of how to do it. And now that the major components of Flex are free and open-source, the cost barrier is gone, as well!    Flex 3 in Action is an easy-to-follow, hands-on Flex tutorial. Chock-full of examples, this book goes beyond feature coverage and helps you put Flex to work in real day-to-day tasks. You'll quickly master the Flex API and learn to apply the techniques that make your Flex applications stand out from the crowd.    Interesting themes, styles, and skins  It's in there.  Working with databases  You got it.  Interactive forms and validation  You bet.  Charting techniques to help you visualize data  Bam!  The expert authors of Flex 3 in Action have one goal   to help you get down to business with Flex 3. Fast.    Many Flex books are overwhelming to new users   focusing on the complexities of the language and the super-specialized subjects in the Flex eco-system; Flex 3 in Action filters out the noise and dives into the core topics you need every day. Using numerous easy-to-understand examples, Flex 3 in Action gives you a strong foundation that you can build on as the complexity of your projects increases.",PUBLISH,"tariq ahmed with jon hirschi, faisal abid",internet
Flex 4 In Action,1935182420,600.0,2010-11-15 08:00:00+00:00,https://s3.amazonaws.com/AKIAJC5RLADLUMVRPFDQ.book-thumb-images/ahmed2.jpg,No description available,"""Using Flex, you can create high-quality, effective, and interactive Rich Internet Applications (RIAs) quickly and easily. Flex removes the complexity barrier from RIA development by offering sophisticated tools and a straightforward programming language so you can focus on what you want to do instead of how to do it. And the new features added in Flex 4 give you an even wider range of options!    Flex 4 in Action is an easy-to-follow, hands-on Flex tutorial that goes beyond feature coverage and helps you put Flex to work in real day-to-day tasks. You'll quickly master the Flex API and learn to apply the techniques that make your Flex applications stand out from the crowd.    The expert authors of Flex 4 in Action have one goal-to help you get down to business with Flex. Fast. Flex 4 in Action filters out the noise and dives into the core topics you need every day. Using numerous easy-to-understand examples, Flex 4 in Action gives you a strong foundation that you can build on as the complexity of your projects increases.    Interesting themes, styles, and skins  It's in there.  Working with databases  You got it.  Interactive forms and validation  You bet.  Charting techniques to help you visualize data  Bam!  And you'll get full coverage of these great Flex 4 upgrades:  Next generation Spark components-New buttons, form inputs, navigation controls and other visual components replace the Flex 3 """"Halo"""" versions. Spark components are easier to customize",desconocido,which helps when trying to debug applications that are communicating to another system/service numerous productivity boosting features that speed up the process of creating applications a faster compiler to take your human-written source code and convert it into a machine-readable format built-in support for unit testing allows you to improve the quality of your software,"and reduce the time spent in testing"""
Collective Intelligence In Action,1933988312,425.0,2008-10-01 07:00:00+00:00,https://s3.amazonaws.com/AKIAJC5RLADLUMVRPFDQ.book-thumb-images/alag.jpg,No description available,"There's a great deal of wisdom in a crowd, but how do you listen to a thousand people talking at once  Identifying the wants, needs, and knowledge of internet users can be like listening to a mob.    In the Web 2.0 era, leveraging the collective power of user contributions, interactions, and feedback is the key to market dominance. A new category of powerful programming techniques lets you discover the patterns, inter-relationships, and individual profiles   the collective intelligence   locked in the data people leave behind as they surf websites, post blogs, and interact with other users.    Collective Intelligence in Action is a hands-on guidebook for implementing collective-intelligence concepts using Java. It is the first Java-based book to emphasize the underlying algorithms and technical implementation of vital data gathering and mining techniques like analyzing trends, discovering relationships, and making predictions. It provides a pragmatic approach to personalization by combining content-based analysis with collaborative approaches.    This book is for Java developers implementing collective intelligence in real, high-use applications. Following a running example in which you harvest and use information from blogs, you learn to develop software that you can embed in your own applications. The code examples are immediately reusable and give the Java developer a working collective intelligence toolkit.    Along the way, you work with, a number of APIs and open-source toolkits including text analysis and search using Lucene, web-crawling using Nutch, and applying machine learning algorithms using WEKA and the Java Data Mining (JDM) standard.",PUBLISH,satnam alag,internet
Zend Framework In Action,1933988320,432.0,2008-12-01 08:00:00+00:00,https://s3.amazonaws.com/AKIAJC5RLADLUMVRPFDQ.book-thumb-images/allen.jpg,"Zend Framework in Action is a comprehensive tutorial that shows how to use the Zend Framework to create web-based applications and web services. This book takes you on an over-the-shoulder tour of the components of the Zend Framework as you build a high quality, real-world web application.","""From rather humble beginnings as the Personal Home Page scripting language, PHP has found its way into almost every server, corporation, and dev shop in the world. On an average day, somewhere between 500,000 and 2 million coders do something in PHP. Even when you use a well-understood language like PHP, building a modern web application requires tools that decrease development time and cost while improving code quality. Frameworks such as Ruby-on-Rails and Django have been getting a lot of attention as a result.     For PHP coders, the Zend Framework offers that same promise without the need to move away from PHP. This powerful collection of components can be used in part or as a whole to speed up the development process. Zend Framework has the backing of Zend Technologies; the driving force behind the PHP programming language in which it is written. The first production release of the Zend Framework became available in July of 2007.    Zend Framework in Action is a comprehensive tutorial that shows how to use the Zend Framework to create web-based applications and web services. This book takes you on an over-the-shoulder tour of the components of the Zend Framework as you build a high quality, real-world web application. This book is organized around the techniques you'll use every day as a web developer """"data handling",desconocido,authentication,and so forth. as you follow the running example
Flex On Java,1933988797,265.0,2010-10-15 07:00:00+00:00,https://s3.amazonaws.com/AKIAJC5RLADLUMVRPFDQ.book-thumb-images/allmon.jpg,"   A beautifully written book that is a must have for every Java Developer.       Ashish Kulkarni, Technical Director, E-Business Software Solutions Ltd.","""In the demo, a hip designer, a sharply-dressed marketer, and a smiling, relaxed developer sip lattes and calmly discuss how Flex is going to make customers happy and shorten the workday   all while boosting the bottom line. The software systems they're using have been carefully selected and built from the ground up to work together seamlessly. There are no legacy systems, data, or competing business concerns to manage.    Cut to reality.    You're a Java developer. The marketing guy tells you that """"corporate"""" wants a Flex-based site and you have to deliver it on top of what you already have. Your budget  Don't even ask. """"Make it look like the Discovery channel or something.""""    Flex on Java assumes you live in the real world   not the demo. This unique book shows you how to refactor an existing web application using the server-side you already know. You'll learn to use Flex 3 in concert with Spring",desconocido,pojos,jms
Griffon In Action,1935182234,375.0,2012-06-04 07:00:00+00:00,https://s3.amazonaws.com/AKIAJC5RLADLUMVRPFDQ.book-thumb-images/almiray.jpg,"Griffon in Action is a comprehensive tutorial written for Java developers who want a more productive approach to UI development. In this book, you'll immediately dive into Griffon. After a Griffon orientation and a quick Groovy tutorial, you'll start building examples that explore Griffon's high productivity approach to Swing development. One of the troublesome parts of Swing development is the amount of Java code that is required to get a simple application off the ground.","Although several options exist for interface development in Java, even popular UI toolkits like Swing have been notoriously complex and difficult to use. Griffon, an agile framework that uses Groovy to simplify Swing, makes UI development dramatically faster and easier. In many respects, Griffon is for desktop development what Grails is for web development. While it's based on Swing, its declarative style and approachable level of abstraction is instantly familiar to developers familiar with other technologies such as Flex or JavaFX.    Griffon in Action is a comprehensive tutorial written for Java developers who want a more productive approach to UI development. In this book, you'll immediately dive into Griffon. After a Griffon orientation and a quick Groovy tutorial, you'll start building examples that explore Griffon's high productivity approach to Swing development. One of the troublesome parts of Swing development is the amount of Java code that is required to get a simple application off the ground.    You'll learn how SwingBuilder (and its cousin builders) present a very palatable alternative in the form of a DSL geared towards building graphical user interfaces. Pair it up with the convention over configuration paradigm, a well tested and tried application source structure (based on Grails) and you have a recipe for quick and effective Swing application development. Griffon in Action covers declarative view development, like the one provided by JavaFX Script, as well as the structure, architecture and life cycle of Java application development",PUBLISH,"andres almiray, danno ferrin, , james shingler",java
Osgi In Depth,193518217X,325.0,2011-12-12 08:00:00+00:00,https://s3.amazonaws.com/AKIAJC5RLADLUMVRPFDQ.book-thumb-images/alves.jpg,"Enterprise OSGi shows a Java developer how to develop to the OSGi Service Platform Enterprise specification, an emerging Java-based technology for developing modular enterprise applications. Enterprise OSGi addresses several shortcomings of existing enterprise platforms, such as allowing the creation of better maintainable and extensible applications, and provide a simpler, easier-to-use, light-weight solution to enterprise software development.","A good application framework greatly simplifies a developer's task by providing reusable code modules that solve common, tedious, or complex tasks. Writing a great framework requires an extraordinary set of skills-ranging from deep knowledge of a programming language and target platform to a crystal-clear view of the problem space where the applications to be developed using the framework will be used.    OSGi Application Frameworks shows a Java developer how to build frameworks based on the OSGi service platform. OSGi, an emerging Java-based technology for developing modular applications, is a great tool for framework building. A framework itself, OSGi allows the developer to create a more intuitive, modular framework by isolating many of the key challenges the framework developer faces.    This book begins by describing the process, principles, and tools you must master to build a custom application framework. It introduces the fundamental concepts of OSGi, and then shows you how to put OSGi to work building various types of frameworks that solve specific development problems.    OSGi is particularly useful for building frameworks that can be easily extended by developers to create domain-specific applications. This book teaches the developer to break down a problem domain into its abstractions and then use OSGi to create a modular framework solution. Along the way, the developer learns software engineering practices intrinsic to framework building that result in systems with better software qualities, such as flexibility, extensibility, and maintainability.    Author Alexandre Alves guides you through major concepts, such as the definition of programming models and modularization techniques, and complements them with samples that have real applicability using industry-proved technologies, such as Spring-DM and Equinox.",PUBLISH,alexandre de castro alves,java
Flexible Rails,1933988509,592.0,2008-01-01 08:00:00+00:00,https://s3.amazonaws.com/AKIAJC5RLADLUMVRPFDQ.book-thumb-images/armstrong.jpg,"""""""Flexible Rails created a standard to which I hold other technical books. You definitely get your money's worth.""""""","""Rails is a fantastic tool for web application development, but its Ajax-driven interfaces stop short of the richness you gain with a tool like Adobe Flex. Simply put, Flex is the most productive way to build the UI of rich Internet applications, and Rails is the most productive way to rapidly build a database-backed CRUD application. Together, they're an amazing combination.    Flexible Rails is a book about how to use Ruby on Rails and Adobe Flex to build next-generation rich Internet applications (RIAs). The book takes you to the leading edge of RIA development, presenting examples in Flex 3 and Rails 2.    This book is not an exhaustive Ruby on Rails tutorial, nor a Flex reference manual. (Adobe ships over 3000 pages of PDF reference documentation with Flex.) Instead, it's an extensive tutorial, developed iteratively, how to build an RIA using Flex and Rails together. You learn both the specific techniques you need to use Flex and Rails together as well as the development practices that make the combination especially powerful.    The example application built in the book is MIT-licensed, so readers can use it as the basis for their own applications. In fact, one reader has already built an agile project management tool based on the book example!    With this book, you learn Flex by osmosis. You can read the book and follow along even if you have never used Flex before. Consider it """"Flex Immersion."""" You absorb the key concepts of Flex as you go through the process of building the application.    You will also learn how Flex and Rails integrate with HTTPService and XML",desconocido,including tips to use cairngorm in a less verbose way with httpservice to talk to rails. flexible rails is for both rails developers who are interested in flex,and flex developers who are interested in rails. for a rails developer
Hello! Flex 4,1933988762,258.0,2009-11-01 07:00:00+00:00,https://s3.amazonaws.com/AKIAJC5RLADLUMVRPFDQ.book-thumb-images/armstrong3.jpg,"Hello! Flex 4 progresses through 26 self-contained examples selected so you can progressively master Flex. They vary from small one-page apps, to a 3D rotating haiku, to a Connect Four-like game. And in the last chapter you'll learn to build a full Flex application called SocialStalkr   a mashup that lets you follow your friends by showing their tweets on a Yahoo map.","With Flex 4 you can easily add color and life to your web applications by introducing dynamic user features, slick transitions, and eye-catching animations. Flex also provides powerful data handling capabilities so you can build industrial-strength applications. And it's open source, so you can get started without forking over a lot of your hard-earned cash.    We think it should be just as much fun to learn Flex as it is to use Flex. Hello! Flex 4 shows you everything you need to know to get started with Flex 4 without bogging you down in obscure detail or academic edge cases. In this entertaining, hands-on book, you'll quickly move from Hello World into the techniques you'll need to use Flex effectively.    You'll start by progressing through 26 self-contained workshop items, which include everything from small one-page examples, to a 3D rotating haiku, to building a Connect Four game. Finally, in the last chapter you'll build a full Flex application called 'SocialStalkr': an interesting mashup of Twitter and Yahoo Maps that lets you 'stalk' your friends by showing specially formatted Twitter tweets on a Yahoo map.",PUBLISH,peter armstrong,internet
Coffeehouse,1884777384,316.0,1997-07-01 07:00:00+00:00,https://s3.amazonaws.com/AKIAJC5RLADLUMVRPFDQ.book-thumb-images/asher.jpg,"Coffeehouse is an anthology of stories, poems and essays originally published on the World Wide Web.","""Coffeehouse is an anthology of stories, poems and essays originally published on the World Wide Web. The purpose is to capture the zeitgeist of the web's creative community, and to give readers a chance to enjoy some of the best and most notable original works that have appeared in this form. It showcases over forty individual web writers, among them Joseph Squier, Martha Conway, Jason Snell, David Alexander, Carl Steadman and Walter Miller. The intent is to show the variety and vitality of the web's blossoming literary """"scene",desconocido,publish,"levi asher, christian crumlish"
Team Foundation Server 2008 In Action,1933988592,344.0,2008-12-01 08:00:00+00:00,https://s3.amazonaws.com/AKIAJC5RLADLUMVRPFDQ.book-thumb-images/azher.jpg,No description available,"In complex software projects, managing the development process can be as critical to success as writing the code itself. A project may involve dozens of developers, managers, architects, testers, and customers, hundreds of builds, and thousands of opportunities to get off-track. To keep tabs on the people, tasks, and components of a medium- to large-scale project, most teams use a development system that allows for easy monitoring, follow-up, and accountability.    Microsoft Team Foundation Server 2008 (TFS), the server component of Microsoft's Visual Studio Team System (VSTS), provides a powerful collaborative platform for software-development teams. The product offers an integrated toolset for tracking work items, creating test cases, managing source code, generating builds, constructing database schemas, and so on. Because in software development one size does not fit all, TFS provides process customization, project management, and reporting capabilities to build solutions around your requirements.    Team Foundation Server 2008 in Action is a hands-on guide to Team Foundation Server 2008. Written for developers with a good handle on TFS basics, this book shows you how to solve real-life problems. It's not a repetition of Microsoft's product documentation. Team Foundation Server 2008 in Action is a practitioner's handbook for how to work with TFS under common constraints. This book walks you through real-life software engineering problems based on hundreds of hours of TFS experience.    You'll benefit from expert author Jamil Azher's extensive interactions with members of Microsoft's TFS team and MVPs, survey feedback from the author's blog, and interviews with organizations and user groups using TFS. Instead of just offering a high-level overview, the book provides detailed solutions for solving common   and not-so-common   problems using TFS. It discusses the strengths as well as weaknesses of TFS, and suggests appropriate problem resolution steps, workarounds, or custom solutions.",PUBLISH,jamil azher,microsoft .net
Brownfield Application Development In .Net,1933988711,550.0,2010-04-16 07:00:00+00:00,https://s3.amazonaws.com/AKIAJC5RLADLUMVRPFDQ.book-thumb-images/baley.jpg,"Brownfield Application Development in .Net shows you how to approach legacy applications with the state-of-the-art concepts, patterns, and tools you've learned to apply to new projects. Using an existing application as an example, this book guides you in applying the techniques and best practices you need to make it more maintainable and receptive to change.","""It's easy to get excited about building a new software project from scratch. So-called """"greenfield"""" projects often involve learning new technology and the opportunity for experimentation. Working on established software projects may seem less glamorous.    Most software developers have inherited a monolithic application where the day-to-day tasks involve maintenance",desconocido,or even cleaning up the mess another programmer left behind. these legacy or brownfield projects often have tightly coupled components,low cohesion
