title,isbn,pageCount,publishedDate,thumbnailUrl,shortDescription,longDescription,status,authors,categories
The Awesome Power Of Java Beans,1884777562,500.0,1998-05-01 07:00:00+00:00,https://s3.amazonaws.com/AKIAJC5RLADLUMVRPFDQ.book-thumb-images/rodrigues.jpg,No description available,"Build your own bean  Or use one that's ready-made  The Awesome Power of Java Beans provides the details on both. Either way, the power of Java Beans is awesome: once created, your beans run anywhere-- ceven masquerading as an ActiveX control.    The Awesome Power of Java Beans shows you how to use not only BeanBox, but also such tools as VisualAge WebRunner, JBuilder and PowerJ. And there's a wide-ranging selection of completed and tested beans for you to use in your applications    If you're a Java programmer, teacher or student, or if you design software systems using Java Beans, this book will be a valuable resource.",PUBLISH,lawrence h. rodrigues,java
Personal Videoconferencing,013268327X,420.0,1996-06-01 07:00:00+00:00,https://s3.amazonaws.com/AKIAJC5RLADLUMVRPFDQ.book-thumb-images/rosen.jpg,"""""""Personal Videoconferencing is having an enormous impact on business. Evan Rosen has quantified that impact with examples of real world implementations and provided a primer on how businesses can achieve this competitive advantage for themselves.""""  --Frank Gill", Executive Vice President,desconocido,"intel """"the book is very good: it is clear and the examples of user applications are excellent"""" --ralph ungermann",ceo
The Cloud At Your Service,1935182528,200.0,2010-11-22 08:00:00+00:00,https://s3.amazonaws.com/AKIAJC5RLADLUMVRPFDQ.book-thumb-images/rosenberg.jpg,No description available,No description available,PUBLISH,"jothy rosenberg, arthur mateos",internet
Implementing Elliptic Curve Cryptography,1884777694,330.0,1998-11-01 08:00:00+00:00,https://s3.amazonaws.com/AKIAJC5RLADLUMVRPFDQ.book-thumb-images/rosing.jpg,"""""""The book provides all the theory and working programs needed to create real applications based on the latest IEEE P1363 standard.""""  --Reviewed in Cryptologia""","""Implementing Elliptic Curve Cryptography proceeds step-by-step to explain basic number theory, polynomial mathematics, normal basis mathematics and elliptic curve mathematics. With these in place, applications to cryptography are introduced. The book is filled with C code to illustrate how mathematics is put into a computer, and the last several chapters show how to implement several cryptographic protocols. The most important is a description of P1363, an IEEE draft standard for public key cryptography.    The main purpose of Implementing Elliptic Curve Cryptography is to help """"crypto engineers"""" implement functioning",desconocido,the reader can expand on the code given in the book and develop optimal hardware or software for their own applications. implementing elliptic curve cryptography assumes the reader has at least a high school background in algebra,but it explains
Soa Patterns,1933988266,250.0,2012-09-12 07:00:00+00:00,https://s3.amazonaws.com/AKIAJC5RLADLUMVRPFDQ.book-thumb-images/rotem.jpg,"In SOA Patterns, author Arnon Rotem-Gal-Oz provides detailed, technology-neutral solutions to these challenges, and many others. This book provides architectural guidance through patterns and anti-patterns. It shows you how to build real SOA services that feature flexibility, availability, and scalability.","SOA   Service Oriented Architecture   has become the leading solution for complex, connected business systems. While it's easy to grasp the theory of SOA, implementing well-designed, practical SOA systems can be a difficult challenge. Developers and enterprise architects still face the following issues:        * How to get high-availability with SOA      * How to know a service has failed      * How to create reports when data is scattered within multiple services      * How to increase the loose coupling of your SOA      * How to solve authentication and authorization for service consumers--internal and external      * How to integrate SOA and the UI      * How to avoid common SOA pitfalls      * How to choose technologies that increase the performance of your services    In SOA Patterns, author Arnon Rotem-Gal-Oz provides detailed, technology-neutral solutions to these challenges, and many others. This book provides architectural guidance through patterns and anti-patterns. It shows you how to build real SOA services that feature flexibility, availability, and scalability. Through an extensive set of patterns, this book identifies the major SOA pressure points and provides reusable techniques to address them. Each pattern pairs the classic Problem/Solution format with a unique technology map, showing where specific solutions fit into the general pattern.    SOA Patterns shows you how to address common SOA concerns, including the areas of performance, availability, scalability, security, management, service interaction, user interface interaction, and service aggregation. The SOA anti-patterns part shows you how to avoid common mistakes and how to refactor broken systems. The book also maps quality attributes to patterns so that you can easily find the patterns relevant to your problems.    WHAT'S INSIDE:        * Details more than 30 patterns for common SOA scenarios in the areas of security, performace, availability, UI integration, service aggregation and service interaction      * Describes more than 20 SOA pitfalls to avoid      * Spotlights the architecural perspective on SOA      * Explains technology mapping from conceptual solution to current technologies      * Provides extensive and practical advice on matching patterns to technologies  ",PUBLISH,arnon rotem-gal-oz,soa
Hello World!,1933988495,432.0,2009-03-01 08:00:00+00:00,https://s3.amazonaws.com/AKIAJC5RLADLUMVRPFDQ.book-thumb-images/sande.jpg,Hello World! provides a gentle but thorough introduction to the world of computer programming.,"Your computer won't respond when you yell at it. Why not learn to talk to your computer in its own language  Whether you want to write games, start a business, or you're just curious, learning to program is a great place to start. Plus, programming is fun!    Hello World! provides a gentle but thorough introduction to the world of computer programming. It's written in language a 12-year-old can follow, but anyone who wants to learn how to program a computer can use it. Even adults. Written by Warren Sande and his son, Carter, and reviewed by professional educators, this book is kid-tested and parent-approved.    You don't need to know anything about programming to use the book. But you should know the basics of using a computer--e-mail, surfing the web, listening to music, and so forth. If you can start a program and save a file, you should have no trouble using this book.",PUBLISH,"warren d. sande, carter sande","programming, python"
Scbcd Exam Study Kit,1932394400,488.0,2005-06-01 07:00:00+00:00,https://s3.amazonaws.com/AKIAJC5RLADLUMVRPFDQ.book-thumb-images/sanghera.jpg,No description available,"There is probably no Java certification more valuable to you than Sun Certified Business Component Developer CX-310-090. To pass you need a readable, no-nonsense book focused like a laser beam on the exam goals. SCBCD Exam Study Kit is that book.    The study kit makes sure you first understand all the concepts you need to know, large and small, and then covers every single exam topic. It provides more than 130 review questions with answers distributed over all chapters and an Exam's Eye View section at the end of each chapter on the important points to remember.    Although SCBCD Exam Study Kit has only one purpose - to help you get certified - you will find yourself returning to it as a reference after passing the exam. A demo on how to install the necessary software, write a simple bean, deploy the bean, and execute it, as well as a free SCBCD exam simulator can be downloaded from the publisher's website.",PUBLISH,paul sanghera,java
Portlets In Action,1935182544,475.0,2011-09-16 07:00:00+00:00,https://s3.amazonaws.com/AKIAJC5RLADLUMVRPFDQ.book-thumb-images/sarin.jpg,"Portlets in Action is a comprehensive guide for Java developers with minimal or no experience working with portlets. Fully exploring the Portlet 2.0 API and using widely adopted frameworks like Spring 3.0 Portlet MVC, Hibernate, and DWR, it teaches you portal and portlet development by walking you through a Book Catalog portlet and Book Portal examples.","""A """"portal"""" is a browser-based container populated by small applications called """"portlets"""". Good portlets need to work independently",desconocido,other portlets,and outside servers and information sources. whether they're part of internal or web-facing portals
Swt/Jface In Action,1932394273,496.0,2004-11-01 08:00:00+00:00,https://s3.amazonaws.com/AKIAJC5RLADLUMVRPFDQ.book-thumb-images/scarpino.jpg,Guides you through the process of developing Eclipse-based GUIs and shows how to build applications with features your users will love. Packed with examples and no fluff.,"SWT and JFace are Eclipse's graphical libraries. They enable you to build nimble and powerful Java GUIs--but this is only the beginning. With Draw2D and the Graphical Editing Framework, you can go beyond static applications and create full-featured editors. And with the Rich Client Platform, you can build customized workbenches whose capabilities far exceed those of traditional interfaces.    SWT/JFace in Action covers the territory, from simple widgets to complex graphics. It guides you through the process of developing Eclipse-based GUIs and shows how to build applications with features your users will love. The authors share their intimate knowledge of the subject with you in a friendly, readable style.    This book encourages you to learn through action. Each topic provides extensive code to show you how SWT/JFace works in practical applications. Not only do these examples help you understand the subject, they are a working set of programs you can reuse in your own interfaces.",PUBLISH,"matthew scarpino, stephen holder, stanford ng, , laurent mihalkovic",java
Opencl In Action,1617290173,0.0,2011-11-14 08:00:00+00:00,https://s3.amazonaws.com/AKIAJC5RLADLUMVRPFDQ.book-thumb-images/scarpino2.jpg,No description available,No description available,PUBLISH,matthew scarpino,programming
Multiprotocol Over Atm,138892709,341.0,1998-03-01 08:00:00+00:00,https://s3.amazonaws.com/AKIAJC5RLADLUMVRPFDQ.book-thumb-images/schmidt.jpg,"With the detailed coverage of the entire set of protocols in Multiprotocol over ATM, you can be equal to the task.","Networks constructed with current ATM protocol design standards exceed by far former network capabilities. Unfortunately, this new ATM power and flexibility come at the cost of greater complexity. With the detailed coverage of the entire set of protocols in Multiprotocol over ATM, you can be equal to the task. If you're a network manager or designer, responsible for planning, building, or managing an enterprise or campus network, this book is for you.",PUBLISH,"andrew schmidt, daniel minoli","internet, networking"
Dependency Injection In .Net,1935182501,375.0,2011-10-03 07:00:00+00:00,https://s3.amazonaws.com/AKIAJC5RLADLUMVRPFDQ.book-thumb-images/seemann.jpg,"Dependency Injection in .NET is a comprehensive guide than introduces DI and provides an in-depth look at applying DI practices to .NET apps. In it, you will also learn to integrate DI together with such technologies as Windows Communication Foundation, ASP.NET MVC, Windows Presentation Foundation and other core .NET components.","Dependency Injection (DI) is a software design technique emphasizing Separation of Concerns, Modularity, Extensibility and Testability. Applied well, it enables programmers to successfully deal with complexity in software and add new features to existing apps with greater ease. DI is the key to writing modular software and producing flexible and maintainable code bases.    While well-known among Java developers and other practitioners of object-oriented design, DI is only now gaining momentum in the .NET community. The Unity container released by Microsoft patterns & practices and the new Microsoft Extensibility Framework (MEF) make DI more relevant than ever for .NET developers.    Dependency Injection in .NET is a comprehensive guide than introduces DI and provides an in-depth look at applying DI practices to .NET apps. In it, you will also learn to integrate DI together with such technologies as Windows Communication Foundation, ASP.NET MVC, Windows Presentation Foundation and other core .NET components.    Building on your existing knowledge of C# and the .NET platform, this book will be most beneficial for readers who have already built at least a few software solutions of intermediate complexity. Most examples are in plain C# without use of any particular DI framework. Later, the book introduces several well-known DI frameworks, such as StructureMap, Windsor and Spring.NET. For each framework, it presents examples of its particular usage, as well as examines how the framework relates to the common patterns presented earlier in the book.    WHAT'S INSIDE        * A thorough introduction to DI principles applied to .NET development      * Numerous C#-based examples      * A comprehensive catalog of Patterns and Anti-Patterns      * Understand the importance of loose coupling      * Learn DI Containers including StructureMap, Windsor, Spring.NET and the Microsoft Extensibility Framework      * Identify and avoid common traps",PUBLISH,mark seemann,microsoft .net
Java 3D Programming,1930110359,400.0,2002-03-01 08:00:00+00:00,https://s3.amazonaws.com/AKIAJC5RLADLUMVRPFDQ.book-thumb-images/selman.jpg,No description available,"Java 3D Programming steps programmers through the important design and implementation phases of developing a successful Java 3D application. The book provides invaluable guidance on whether to use Java 3D, user interface design, geometry creation, scene manipulation and final optimizations. The book does not attempt to exhaustively cover the API or replicate the official documentation but rather serves as a roadmap to alert programmers of design issues and potential pitfalls.    The author distills 12 months of using the Java 3D API for commercial projects, as well as innumerable discussions on the Java 3D email list into a book that all Java 3D developers will appreciate. Experienced Java 3D developers will applaud an authoritative resource containing the state-of-the-art in techniques and workarounds, while novice Java 3D programmers will gain a fast-track into Java 3D development, avoiding the confusion, frustration and time wasted learning Java 3D techniques and terminology.    Java 3D Programming comes complete with a comprehensive set of programming examples to illustrate the techniques, features, workarounds and bug fixes contained in the main text.    Readers of this book would include students and postgraduate researchers developing visualization applications for academia. Moderately experienced in Java, some experience of 3D graphics, little or no experience of Java 3D is needed. R+D s/w engineers at commercial institutions. Experienced Java developers, experienced with OpenGL or VRML, little or no experience with Java 3D.",PUBLISH,daniel selman,"java, internet, computer graph"
Liferay In Action,193518282X,375.0,2011-09-20 07:00:00+00:00,https://s3.amazonaws.com/AKIAJC5RLADLUMVRPFDQ.book-thumb-images/sezov.jpg,No description available,No description available,PUBLISH,"richard sezov, jr",internet
Jsp Tag Libraries,193011009X,656.0,2001-05-01 07:00:00+00:00,https://s3.amazonaws.com/AKIAJC5RLADLUMVRPFDQ.book-thumb-images/shachor.jpg,No description available,"JSP Tag Libraries is a bible for serious JSP developers. The reader will become acquainted with the world of custom JSP tags--new JSP technology that is beginning to have an enormous impact on the way people are developing JSP.    JSP tags are Java components that can be used from within a JSP file. By representing these components as tags, code authors can open up their JSP development to the everyday content developer as well as improve their code reuse and separation between presentation and business logic.    The book is fully loaded with many real-world tags including tags to perform iterations, access databases, EJBs, email systems and JavaBeans. To make the tag usage even more real, the book also offers two full-scale case studies in which the reader will see how tags can be used in the context of:    e-Commerce applications  WAP applications that work with current cellular phones  This book covers all aspects of JSP Tag development for Scriptlet-free generation of online content. It focuses on reusable component-centric design via JavaBeans and custom tags to separate presentation from implementation.",PUBLISH,"gal shachor, adam chace, magnus rydin","java, internet"
Instant Messaging In Java,1930110464,402.0,2002-03-01 08:00:00+00:00,https://s3.amazonaws.com/AKIAJC5RLADLUMVRPFDQ.book-thumb-images/shigeoka.jpg,This intermediate Java programming book provides Java programmers with the information and tools needed to create your own IM client and server software.,"Instant Messaging has exploded into the online world and is a wildly popular service of the largest Internet Service Providers (ISP) like AOL with AOL Instant Messenger, MSN with Microsoft Messenger, and Yahoo with Yahoo Messenger. Millions of Internet users everyday exchange IM s and its use beyond messaging is just around the corner. For example, the new Microsoft .NET platform will be using instant messaging technology for data exchange.    This intermediate Java programming book provides Java programmers with the information and tools needed to create your own IM client and server software. You can use the software to create your own IM systems or integrate IM features into your existing software. Imagine allowing your customers to chat directly with technical support or other users from within your application!    This book focuses on the open source Jabber XML-based IM protocols (www.jabber.org) to create Java IM software. These open protocols allows your IM software to seamlessly communicate with the large number of other Jabber clients and servers available including commercial Jabber systems like the one that powers Disney's go.com IM.    Readers are assumed to know how to program in Java. No prior knowledge of Jabber or IM is needed.",PUBLISH,iain shigeoka,"internet, java"
Java Applets And Channels Without Programming,1884777392,372.0,1999-12-01 08:00:00+00:00,https://s3.amazonaws.com/AKIAJC5RLADLUMVRPFDQ.book-thumb-images/shoffner.jpg,"Java Applets and Channels Without Programming collects almost 100 applets on a CD with detailed instructions on how to use each applet. In addition, style issues are discussed in detail; not only will you learn how to use each applet, you will learn when and where it is appropriate to use each applet. The book also introduces the new concept of channels and shows how these can be used on your web site as well.  ","If you want to use Java to enhance your Web site, you have two choices: you can write the Java applet yourself or you can find an already written Java applet that meets your needs. If you prefer not to do the writing yourself, then Java Applets and Channels Without Programming is for you. It collects almost 100 applets on a CD with detailed instructions on how to use each applet. In addition, style issues are discussed in detail; not only will you learn how to use each applet, you will learn when and where it is appropriate to use each applet. The book also introduces the new concept of channels and shows how these can be used on your web site as well.    The CD-ROM also contains an exclusive applet configuration utility, a program that allows you to configure the Java applets on the CD-ROM in a WYSIWYG (What You See Is What You Get) environment. When using the utility to configure Java applets, you do not need to know any Java programming or even any HTML programming. All you do is change the value of a parameter and click on a button to see the resulting change to the applet. The applet configuration utility is written in Java and runs in your browser, so it runs on any computer platform for which there is a Java-enabled browser.    The CD-ROM also provides example web pages for more than 60 of the included applets, so you can learn how to use the applets in real-world situations.",PUBLISH,"ronny richardson, michael shoffner, marq singer, bruce murray, , jack gambol",java
Powershell In Practice,1935182005,500.0,2010-06-08 07:00:00+00:00,https://s3.amazonaws.com/AKIAJC5RLADLUMVRPFDQ.book-thumb-images/siddaway.jpg,"PowerShell in Practice is a hands-on, cookbook-style reference intended for administrators wanting to learn and use PowerShell. Written from an administrator's perspective, it concentrates on using PowerShell for practical tasks and automation. The book starts with an introduction that includes a rapid tutorial and a review of the key areas in which you'll use PowerShell.","""Whether you're optimizing performance, automating tasks, or exploiting software features, efficiency is the key to a system administrator's success. Anything that saves a few cycles is a welcome addition to your toolbox; Windows PowerShell has the potential to change the game entirely.    Windows PowerShell is a new scripting language written from the ground up with the goal of simplifying Windows system administration. It's fully aware of the Windows platform and is tightly integrated with key server technologies like Exchange, IIS, SQL Server. PowerShell borrows many ideas from the Unix scripting world, so it's instantly familiar to anyone who has scripted in Bash or another Unix shell. It's also a first-class programming language that supports everything from single-line commands to full-featured Windows programs.    PowerShell in Practice is a hands-on, cookbook-style reference intended for administrators wanting to learn and use PowerShell. Written from an administrator's perspective, it concentrates on using PowerShell for practical tasks and automation. The book starts with an introduction that includes a rapid tutorial and a review of the key areas in which you'll use PowerShell.    This book is written to answer the question """"How can PowerShell make my job as an administrator easier """" After you have your feet under you",desconocido,called working with people,addresses user accounts
Powershell And Wmi,1617290114,0.0,2012-04-30 07:00:00+00:00,https://s3.amazonaws.com/AKIAJC5RLADLUMVRPFDQ.book-thumb-images/siddaway2.jpg,No description available,No description available,PUBLISH,richard siddaway,microsoft .net
Making Sense Of Java,132632942,180.0,1996-06-01 07:00:00+00:00,https://s3.amazonaws.com/AKIAJC5RLADLUMVRPFDQ.book-thumb-images/simpson.jpg,"Making Sense of Java clearly and concisely explains the concepts, features, benefits, potential, and limitations of Java.","The meteoric rise of interest in Java, and the simultaneous rise in Java-related hype, make this book's no-nonsense evaluation essential reading for all levels of professionals, from managers to programmers. Making Sense of Java clearly and concisely explains the concepts, features, benefits, potential, and limitations of Java. It is not a programmer's how-to guide and assumes little technical knowledge, though software developers will find this lucid overview to be a valuable introduction to the possible uses and capabilities of Java.",PUBLISH,"bruce simpson, john mitchell, brian christeson, rehan zaidi, , jonathan levine","java, business"
C++/Cli In Action,1932394818,416.0,2007-04-01 07:00:00+00:00,https://s3.amazonaws.com/AKIAJC5RLADLUMVRPFDQ.book-thumb-images/sivakumar.jpg,"   ... a great resource, an outstanding job, a must-read...        Ayman B. Shoukry, VC++ Team, Microsoft Corporation","Developers initially welcomed Microsoft   s Managed C++ for .NET, but the twisted syntax made it difficult to use. Its much-improved replacement, C++/CLI, now provides an effective bridge between the native and managed programming worlds. Using this technology, developers can combine existing C++ programs and .NET applications with little or no refactoring. Accessing .NET libraries like Windows Forms, WPF, and WCF from standard C++ is equally easy.    C++/CLI in Action is a practical guide that will help you breathe new life into your legacy C++ programs. The book begins with a concise C++/CLI tutorial. It then quickly moves to the key themes of native/managed code interop and mixed-mode programming. You   ll learn to take advantage of GUI frameworks like Windows Forms and WPF while keeping your native C++ business logic. The book also covers methods for accessing C# or VB.NET components and libraries. Written for readers with a working knowledge of C++.",PUBLISH,nishant sivakumar,microsoft
