title,isbn,pageCount,publishedDate,thumbnailUrl,shortDescription,longDescription,status,authors,categories
Javaserver Faces In Action,1932394125,744.0,2004-11-01 08:00:00+00:00,https://s3.amazonaws.com/AKIAJC5RLADLUMVRPFDQ.book-thumb-images/mann.jpg,No description available,"JavaServer Faces helps streamline your web development through the use of UI components and events (instead of HTTP requests and responses). JSF components (buttons, text boxes, checkboxes, data grids, etc.) live between user requests, which eliminates the hassle of maintaining state. JSF also synchronizes user input with application objects, automating another tedious aspect of web development.    JavaServer Faces in Action is an introduction, a tutorial, and a handy reference. With the help of many examples, the book explains what JSF is, how it works, and how it relates to other frameworks and technologies like Struts, Servlets, Portlets, JSP, and JSTL. It provides detailed coverage of standard components, renderers, converters, and validators, and how to use them to create solid applications. This book will help you start building JSF solutions today.",PUBLISH,kito d. mann,java
Linq In Action,1933988169,576.0,2008-01-01 08:00:00+00:00,https://s3.amazonaws.com/AKIAJC5RLADLUMVRPFDQ.book-thumb-images/marguerie.jpg,No description available,"LINQ, Language INtegrated Query, is a new extension to the Visual Basic and C# programming languages designed to simplify data queries and database interaction. It addreses O/R mapping issues by making query operations like SQL statements part of the programming language. Adding to its power, LINQ is extensible and can be used to query various data sources. It offers built-in support for querying in-memory collections like arrays or lists, XML, DataSets, and relational databases.    LINQ in Action is a fast-paced, comprehensive tutorial for professional developers who want to use LINQ. This book explores what can be done with LINQ, shows you how it works in an application, and addresses the emerging best practices. It presents the general purpose query facilities offered by LINQ in the upcoming C# 3.0 and VB.NET 9.0 languages. A running example introduces basic LINQ concepts. You   ll then learn to query unstructured data using LINQ to XML and relational data with LINQ to SQL. Finally, you   ll see how to extend LINQ for custom applications.    LINQ in Action will guide you along as you navigate this new world of lambda expressions, query operators, and expression trees. You   ll also explore the new features of C# 3.0, VB.NET 9.0. The book is very practical, anchoring each new idea with running code.    You will discover all the basics needed to get a clear understanding of LINQ. Whether you want to use LINQ to query objects, XML documents, or relational databases, you will find all the information you need to get started.    But LINQ in Action does not stop at the basic code. This book also shows you how LINQ can be used for advanced processing of data. This includes coverage of LINQ   s extensibility, which allows querying more data sources than those supported by default.    All code samples are built on a concrete business case. The running example, LinqBooks, is a personal book cataloging system that shows you how to create LINQ applications with Visual Studio 2008.",PUBLISH,"fabrice marguerie, steve eichert, jim wooley",microsoft .net
Internet Bbss,132869985,400.0,1996-10-01 07:00:00+00:00,https://s3.amazonaws.com/AKIAJC5RLADLUMVRPFDQ.book-thumb-images/mark.jpg,Internet BBSs: A Guided Tour provides in-depth coverage of the new world of true BBSs now available world-wide. It is a valuable resource for anyone currently using the Internet.,"OK, so you use the Internet. You've surfed some Web sites and maybe sent e-mail. But, chances are, you've overlooked the rich and really personal dimension of the Internet represented by the explosive growth of Internet BBSs. That's because up till now BBS publications were limited in scope to the old era of dial-up BBSs.    Until recently the world of BBSs was geographically compartmentalized: in practical terms only the BBSs within a local telphone call were accessible. Now, the Internet has made all Internet BBSs accessible to anyone in the world. Internet BBSs: A Guided Tour provides in-depth coverage of this new world of true BBSs now available world-wide. It is a valuable resource for anyone currently using the Internet. Users of the major on-line service forums and chat groups should also read it to find out how they can access a much richer variety of BBSs at less cost.",PUBLISH,richard scott mark,internet
Algorithms Of The Intelligent Web,1933988665,368.0,2009-05-29 07:00:00+00:00,https://s3.amazonaws.com/AKIAJC5RLADLUMVRPFDQ.book-thumb-images/marmanis.jpg,No description available,"Web 2.0 applications are best known for providing a rich user experience, but the parts you can't see are just as important   and impressive. Many Web 2.0 applications use powerful techniques to process information intelligently and offer features based on patterns and relationships in the data that couldn't be discovered manually. Successful examples of these Algorithms of the Intelligent Web include household names like Google Ad Sense, Netflix, and Amazon. These applications use the internet as a platform that not only gathers data at an ever-increasing pace but also systematically transforms the raw data into actionable information.    Algorithms of the Intelligent Web is an example-driven blueprint for creating applications that collect, analyze, and act on the massive quantities of data users leave in their wake as they use the web. You'll learn how to build Amazon- and Netflix-style recommendation engines, and how the same techniques apply to people matches on social-networking sites. See how click-trace analysis can result in smarter ad rotations. With a plethora of examples and extensive detail, this book shows you how to build Web 2.0 applications that are as smart as your users.",PUBLISH,"haralambos marmanis, dmitry babenko",web development
Junit In Action,1930110995,384.0,2003-10-01 07:00:00+00:00,https://s3.amazonaws.com/AKIAJC5RLADLUMVRPFDQ.book-thumb-images/massol.jpg,No description available,"Developers in the know are switching to a new testing strategy - unit testing - which interleaves coding and testing in an integrated way. This has proven to be a powerful combination that results in better designed software with fewer defects and faster delivery cycles.    JUnit in Action shows you how to benefit from this strategy using the popular open source testing framework, JUnit. It's a no fluff discussion of unit testing techniques and best practices. It gives examples of tough situations such as how to unit test EJBs, database applications, JSPs and Taglibs. It discusses unit testing of J2EE applications, and shows how to test in automated builds.",PUBLISH,vincent massol with ted husted,java
Tika In Action,1935182854,0.0,2011-12-01 08:00:00+00:00,https://s3.amazonaws.com/AKIAJC5RLADLUMVRPFDQ.book-thumb-images/mattmann.jpg,No description available,No description available,PUBLISH,"chris a. mattmann, jukka l. zitting",java
Ruby In Practice,1933988479,360.0,2009-03-01 08:00:00+00:00,https://s3.amazonaws.com/AKIAJC5RLADLUMVRPFDQ.book-thumb-images/mcanally.jpg,No description available,"Like Ruby itself, Ruby in Practice will make you more productive. The book shows you practical techniques and strategies for small projects and large-scale environments. A cookbook-style reference, it gives you concrete examples of systems integration, messaging, web development, and databases, all in a clear problem/ solution format.    Part 1 of the book concentrates on the Ruby way of developing software, especially how to use Ruby as a tool for integration. Part 2 talks about REST, Web services, asynchronous messaging, and deployment. In the last part, you'll discover how to manage all forms of data   from manipulating structured documents to identity management. Along the way you'll learn how to use Ruby to build new applications, solve more problems with less effort, integrate with your existing applications, and give new life to your legacy systems.",PUBLISH,"jeremy mcanally, assaf arkin",programming
Inside Lotusscript,1884777481,420.0,1997-11-01 08:00:00+00:00,https://s3.amazonaws.com/AKIAJC5RLADLUMVRPFDQ.book-thumb-images/mcginn.jpg,"Develop Notes and Domino Web applications by providing advanced LotusScript code for direct use in your programs. This book emphasizes practical, useable code and solutions to common Notes programming problems.","At last, here's a book that tells you everything that isn't in the Lotus Notes manuals. It's designed to make it easy for you to develop Notes and Domino Web applications by providing advanced LotusScript code for direct use in your programs. It emphasizes practical, useable code and solutions to common Notes programming problems. If you're interested in Internet or Web programming--or if you want to learn Notes programming, from beginner level to advanced, this book is for you!",PUBLISH,joe mcginn,business
Maximum Midi,1884777449,450.0,1997-08-01 07:00:00+00:00,https://s3.amazonaws.com/AKIAJC5RLADLUMVRPFDQ.book-thumb-images/messick.jpg,No description available,"""Maximum MIDI shows you how to build world-class MIDI programs that can play music using computer sound cards or external keyboard instruments, teach music theory and technique, add music to games and allow musicians to record, edit, play and print compositions. Maximum MIDI gives programmers two ways to add MIDI to their programs. A flexible toolkit of C and C++ routines makes developing Windows 95 MIDI programs a breeze, and rock-solid algorithms and tons of field-tested source code allow advanced users to quickly """"roll their own""""--on any platform. Over a dozen example programs show how it's done.    NEW! The Maximum MIDI Programmer's ToolKit now supports both Windows 95 and Windows NT. Popular demand",desconocido,"and caffeine have finally convinced paul to port the toolkit to nt. your copy of maximum midi: music applications in c++ entitles you to download the updated 95/nt dlls (including source code) from the maximum midi website. the new code--and toolkit support via the book's author online forum--is only available to owners of the book.""",publish
Planning And Managing Atm Networks,132621894,320.0,1997-06-01 07:00:00+00:00,https://s3.amazonaws.com/AKIAJC5RLADLUMVRPFDQ.book-thumb-images/minoli.jpg,"Planning and Managing ATM Networks covers strategic planning, initial deployment, overall management, and the day-to-day operation of ATM networks.","Not only is ATM the best available means to greater transmission capacity, it has also the best potential to meet the needs for sophisticated service control, distributed network oversight, efficient operation, and improved flexibility.    Planning and Managing ATM Networks covers strategic planning, initial deployment, overall management, and the day-to-day operation of ATM networks. It defines steps to determine requirements for ATM networks, as ATM implementation becomes widespread in the corporate enterprise network. It describes fundamental management concepts and procedures, including fault and configuration management, performance management, accounting, and security.",PUBLISH,"daniel minoli, thomas w. golway, , norris p. smith","client-server, networking"
Client/Server Applications On Atm Networks,137353006,350.0,1997-01-01 08:00:00+00:00,https://s3.amazonaws.com/AKIAJC5RLADLUMVRPFDQ.book-thumb-images/minoli2.jpg,"Client/Server Appliactions on ATM Networks discusses ATM as the key technology for transforming the enterprise network from data-only to an integrated data, voice, video, image and multimedia corporate infrastructure.","Today, to meet the surging demands of client/server company-wide processes--distributed cooperative computing, business/scientific imaging, video conferencing, multimedia, distance learning and many more--corporations are finding they must extend high-speed communications beyond just a few key sites. This book discusses ATM as the key technology for transforming the enterprise network from data-only to an integrated data, voice, video, image and multimedia corporate infrastructure.    Previous books have covered ATM and client/server separately. This book, intended for networking professionals, is unique in its focus on the hows and whys of the inevitable marriage of these two technologies.",PUBLISH,"daniel minoli, andrew schmidt","client-server, networking"
Javafx In Action,1933988991,373.0,2009-10-01 07:00:00+00:00,https://s3.amazonaws.com/AKIAJC5RLADLUMVRPFDQ.book-thumb-images/morris.jpg,No description available,"Whether you're writing a desktop app, spinning up a rich web interface, or pushing code to a mobile phone, graphics programming should be easier, and more fun, than it currently is. New technologies and devices   not to mention higher user expectations   have greatly multiplied the complexity level of interface programming. Enter JavaFX.    JavaFX is a set of Java-based rich user interface technologies that sits atop the existing Java Standard and Micro Editions, making current Java packages readily accessible from the JavaFX environment. At its heart is JavaFX Script, an innovative, compiled, domain specific language. JavaFX Script boasts a declarative syntax where the code structure mirrors the structure of the interface. Related UI pieces are kept in one efficient bundle, not strewn across multiple locations. A simple coding model reduces code complexity while increasing productivity. The JavaFX-specific libraries for presentation and animation take advantage of JavaFX Script's unique language features.    JavaFX in Action is a hands-on tutorial that introduces and explores JavaFX through numerous bite-sized projects. The book provides a solid grounding in the JavaFX syntax and related APIs by showing you how to apply the key features of the JavaFX platform. You'll absorb the fundamentals of the technology while exploring the possibilities JavaFX open up for your designs.    Author Simon Morris helps you transform variables and operators into bouncing raindrops, brilliant colors, and dancing interface components. Below the chrome, you'll master techniques to make your applications more responsive and user friendly. You'll also learn how to interact with your existing Java code so you can give your old apps some new JavaFX sparkle.",PUBLISH,simon morris,java
Entity Framework 4 In Action,1935182188,576.0,2011-05-01 07:00:00+00:00,https://s3.amazonaws.com/AKIAJC5RLADLUMVRPFDQ.book-thumb-images/mostarda.jpg,"Microsoft Entity Framework in Action introduces the Entity Framework to developers working in .NET who already have some knowledge of ADO.NET. The book begins with a review of the core ideas behind the ORM model and shows how Entity Framework offers a smooth transition from a traditional ADO.NET approach. By presenting numerous small examples and a couple larger case studies, the book unfolds the Entity Framework story in clear, easy-to-follow detail. The infrastructure and inner workings will be highlighted only when there   s the need to understand a particular feature.","To be successful, any significant application has to manage the flow of data effectively. Microsoft   s approach to data has taken another major step forward with the new Entity Framework for .NET. The Entity Framework starts with ideas from Object Relational Management (ORM) tools like NHibernate that help bridge the mismatch between relational databases (like SQL Server) and object oriented languages (like C# and VB.NET). But it also blends in the established ADO.NET model and recent language-based innovations of LINQ to create a powerful new data management paradigm.    Microsoft Entity Framework in Action introduces the Entity Framework to developers working in .NET who already have some knowledge of ADO.NET. The book begins with a review of the core ideas behind the ORM model and shows how Entity Framework offers a smooth transition from a traditional ADO.NET approach. By presenting numerous small examples and a couple larger case studies, the book unfolds the Entity Framework story in clear, easy-to-follow detail. The infrastructure and inner workings will be highlighted only when there   s the need to understand a particular feature.",PUBLISH,"stefano mostarda, marco de sanctis, , daniele bochicchio",microsoft .net
Asp.Net 2.0 Web Parts In Action,193239477X,344.0,2006-09-01 07:00:00+00:00,https://s3.amazonaws.com/AKIAJC5RLADLUMVRPFDQ.book-thumb-images/neimke.jpg,"""""""ASP.NET Web Parts in Action is a must read book for every developer who wants to extend his knowledge of the ASP.NET framework."""" -- Simon Busoli"," DotNetSlackers.com""",desconocido,google/ig,and live.com. the new web parts api makes it easy to centrally manage a portal's parts. asp.net 2.0 web parts in action is packed with annotated code
Sass And Compass In Action,1617290149,300.0,2013-07-26 07:00:00+00:00,https://s3.amazonaws.com/AKIAJC5RLADLUMVRPFDQ.book-thumb-images/netherland.jpg,"Sass and Compass in Action is the definitive guide to stylesheet authoring using these two revolutionary tools. Written for both designers and developers, this book demonstrates the power of both Sass and Compass through a series of examples that address common pain points associated with traditional stylesheet authoring. The book begins with simple topics such as CSS resets and moves on to more involved topics such as grid frameworks and CSS3 vendor implementation differences.","""Cascading Style Sheets paint the web as the user sees it, and for fifteen years, we've been painting the web by hand. Sass and Compass extend standard CSS to give you more flexibility and the option to simplify or automate many tedious tasks. Think of Sass and Compass as power tools that allow stylesheet authors to """"paint"""" with remarkable speed and precision.    Sass is an extension of CSS3",desconocido,standard css using the command line tool or a web-framework plugin. compass is a framework that sits atop sass and tackles common stylesheet problems such as grid layouts,handling css3 vendor differences
Core Owl 5.0,1884777503,500.0,1997-12-01 08:00:00+00:00,https://s3.amazonaws.com/AKIAJC5RLADLUMVRPFDQ.book-thumb-images/neward.jpg,Core OWL 5.0 dives under the surface and into the OWL source code itself. You'll see what new capabilities OWL 5.0 offers the OWL programmer. You'll gain a deeper understanding of what OWL does on your behalf such as the OWL messaging system and its message maps.,"""Are you an OWL programmer frustrated by shallow coverage of OWL topics in current documentation  Core OWL 5.0 takes you well beyond the """"Hello",desconocido,"this book dives under the surface and into the owl source code itself. you'll see what new capabilities owl 5.0 offers the owl programmer. you'll gain a deeper understanding of what owl does on your behalf such as the owl messaging system and its message maps.""",publish
Advanced Owl 5.0,1884777465,570.0,1998-01-01 08:00:00+00:00,https://s3.amazonaws.com/AKIAJC5RLADLUMVRPFDQ.book-thumb-images/neward2.jpg,"Advanced OWL 5.0 covers advanced ways to make the OWL library do those tricky things you thought weren't possible. You'll get a long, exhaustive look at the new features introduced by the OWL 5.0 code. You'll find detailed explanations of how to extend the OWL objects themselves in new directions.","""Are you an OWL programmer who'd like to know more about the new, largely undocumented features of OWL 5.0  Here's a book that covers advanced ways to make the OWL library do those tricky things you thought weren't possible. You'll get a long, exhaustive look at the new features introduced by the OWL 5.0 code. You'll find detailed explanations of how to extend the OWL objects themselves in new directions. If you're an OWL developer who is beyond the """"OWL for Dummies"""" level",desconocido,"elegance and flexibility. """,publish
Server-Based Java Programming,1884777716,592.0,2000-06-01 07:00:00+00:00,https://s3.amazonaws.com/AKIAJC5RLADLUMVRPFDQ.book-thumb-images/neward3.jpg,No description available,"""Java on the server is here to stay. Whether you're using J2EE or writing your own, you will need to understand the fundamental concepts of server-based Java. Server-Based Java Programming teaches those concepts of Java that underlie the J2EE APIs and the best ways to use them. An ongoing focus on the full lifecycle, including administration and deployment, makes this book a rare, practical guide. One of its themes is the theoretical """"three-zeroes"""" goal for server development--zero development",desconocido,and zero deployment. server-based java programming isn't just about implementation--it's also about architecture,and design. you'll learn how to write the code that sustains a cutting-edge enterprise. you will learn nuts-and-bolts topics like classloaders
Sql Server Mvp Deep Dives,1935182048,848.0,2009-11-01 07:00:00+00:00,https://s3.amazonaws.com/AKIAJC5RLADLUMVRPFDQ.book-thumb-images/nielsen.jpg,"SQL Server MVP Deep Dives is organized into five parts: Design and Architecture, Development, Administration, Performance Tuning and Optimization, and Business Intelligence. In each, you'll find concise, brilliantly clear chapters that take on key topics like mobile data strategies, Dynamic Management Views, or query performance.","This is no ordinary SQL Server book. In SQL Server MVP Deep Dives, the world's leading experts and practitioners offer a masterful collection of techniques and best practices for SQL Server development and administration. 53 MVPs each pick an area of passionate interest to them and then share their insights and practical know-how with you.    SQL Server MVP Deep Dives is organized into five parts: Design and Architecture, Development, Administration, Performance Tuning and Optimization, and Business Intelligence. In each, you'll find concise, brilliantly clear chapters that take on key topics like mobile data strategies, Dynamic Management Views, or query performance.    WHAT'S INSIDE        * Topics important for SQL Server pros      * Accessible to readers of all levels      * New features of SQL Server 2008    Whether you're just getting started with SQL Server or you're an old master looking for new tricks, this book belongs on your bookshelf.    The authors of this book have generously donated 100% of their royalties to support War Child International.",PUBLISH,"contributions from 53 sql server mvps, edited by paul nielsen, kalen delaney, greg low, adam machanic, paul s. randal, , kimberly l. tripp",microsoft .net
Sql Server Mvp Deep Dives,9781935182047,848.0,2009-11-15 08:00:00+00:00,https://s3.amazonaws.com/AKIAJC5RLADLUMVRPFDQ.book-thumb-images/nielsenaw.jpg,"SQL Server MVP Deep Dives is organized into five parts: Design and Architecture, Development, Administration, Performance Tuning and Optimization, and Business Intelligence. In each, you'll find concise, brilliantly clear chapters that take on key topics like mobile data strategies, Dynamic Management Views, or query performance.","This is no ordinary SQL Server book. In SQL Server MVP Deep Dives, the world's leading experts and practitioners offer a masterful collection of techniques and best practices for SQL Server development and administration. 53 MVPs each pick an area of passionate interest to them and then share their insights and practical know-how with you.    SQL Server MVP Deep Dives is organized into five parts: Design and Architecture, Development, Administration, Performance Tuning and Optimization, and Business Intelligence. In each, you'll find concise, brilliantly clear chapters that take on key topics like mobile data strategies, Dynamic Management Views, or query performance.",PUBLISH,"contributions from 53 sql server mvps; edited by paul nielsen, kalen delaney, greg low, adam machanic, paul s. randal, , kimberly l. tripp",microsoft .net
Sql Server Mvp Deep Dives,9781935182047,848.0,2009-11-01 07:00:00+00:00,https://s3.amazonaws.com/AKIAJC5RLADLUMVRPFDQ.book-thumb-images/nielsonaw.jpg,No description available,No description available,PUBLISH,"paul nielsen, kalen delaney, greg low, adam machanic, paul s. randal, , kimberly l. tripp",microsoft .net
