title,isbn,pageCount,publishedDate,thumbnailUrl,shortDescription,longDescription,status,authors,categories
"Up To Speed With Swing, Second Edition",1884777759,560.0,1999-10-01 07:00:00+00:00,https://s3.amazonaws.com/AKIAJC5RLADLUMVRPFDQ.book-thumb-images/gutz2.jpg,"Now in its Second Edition, Up to Speed with Swing is for you if you want to get on the fast track to Java Swing. The second edition has been extensively updated to cover Java 1.2 with additional code examples and illustrations.","Now in its Second Edition, Up to Speed with Swing is for you if you want to get on the fast track to Java Swing. The second edition has been extensively updated to cover Java 1.2 with additional code examples and illustrations.    Guided by a master programmer who writes Java for a living, you'll learn Swing from the insider's point of view. Up to Speeed with Swing has one purpose: to save you time mastering Swing. From the basics of Swing to creating a custom look and feel, or from the Model View Controller (MVC) architecture to optimizing your Swing code, this tutorial gives you an understanding of the big picture as well as the experience of working through detailed examples.",PUBLISH,steven gutz,java
Osgi In Action,1933988916,576.0,2011-04-06 07:00:00+00:00,https://s3.amazonaws.com/AKIAJC5RLADLUMVRPFDQ.book-thumb-images/hall.jpg,"OSGi in Action is a comprehensive guide to OSGi with two primary goals. First, it provides a clear introduction to OSGi concepts with examples that are relevant both for architects and developers. The central idea of OSGi is modularity, so you start by learning about OSGi bundles. You'll then see how OSGi handles module lifecycles and follow up with how it promotes service-oriented interaction among application components.","""If you're a Java developer, you've almost certainly heard of OSGi   and also heard that it's becoming quite a big deal. But you may still be wondering exactly """"What is OSGi """"    Simply put",desconocido,called a bundle,for explicitly structuring your application as a set of interconnected modules. osgi lets you install
Gwt In Action,1933988231,632.0,2007-06-01 07:00:00+00:00,https://s3.amazonaws.com/AKIAJC5RLADLUMVRPFDQ.book-thumb-images/hanson.jpg,No description available,"The Google Web Toolkit (GWT) is a new technology from Google that automatically translates Java into JavaScript, making Ajax applications easier to code and deploy. GWT in Action is a comprehensive tutorial for Java developers interested in building the next generation of rich, web-based applications. This book was written by Robert Hanson, creator of the popular GWT Widget Library, and Adam Tacy, a major contributor to the GWT Widget Library.    The Web is experiencing a new growth with an emphasis on rich, web-based applications. These applications can be difficult to build because they rely on JavaScript, which lacks the sophisticated object-oriented structures and static typing of Java, they are tricky to debug, and they require you to manage numerous browser inconsistencies.    In May of 2006 Google released the Google Web Toolkit. GWT enables developers to create Ajax applications in Java. With GWT, you can build your applications using a real object-oriented language and take advantage of Java tools like Eclipse that are already available. Instead of trying to bring tool support to Ajax, Google brought Ajax to a place where the tools already existed.    GWT in Action shows you how to take advantage of these exciting new tools. This clearly-written book is packed with hands-on GWT examples. You   ll absorb the GWT philosophy as you build your first working GWT application.    The book begins by exploring the main features of GWT, including    Compiling Java to JavaScript, the magic that really defines GWT  Building client-side components  Convenient JUnit integration and testing  Interacting with JavaScript and existing JavaScript libraries  Internationalization  You   ll also see how GWT compares to other toolkits.    GWT in Action shows you how to set up your development environment, use and create widgets, communicate with the server, and much more. Readers will follow an example running throughout the book and quickly master the basics of GWT: widgets, panels, and event handling. The book covers the full development cycle, from setting up your development environment, to building the application, then deploying it to the web server. The entire core GWT library is discussed, with details and examples on how it can be extended.    You   ll cover:    Testing, debugging, and deploying GWT Applications  Communicating with GWT-RPC  Examining client-side RPC architecture  Alternative RPC tools: HTTPRequest, RequestBuilder, and FormPanel  Achieving interoperability in GWT with JavaScript Object Notation (JSON)  Making your GWT application flexible and supportable  GWT helps you make the most of Ajax in your web applications and GWT in Action helps you get more out of GWT.",PUBLISH,"robert hanson, adam tacy","internet, java"
The Quick Python Book,1884777740,444.0,1999-10-01 07:00:00+00:00,https://s3.amazonaws.com/AKIAJC5RLADLUMVRPFDQ.book-thumb-images/harms.jpg,No description available,"The Quick Python Book is a clear, concise introduction to Python, one of the most elegant programming languages in existence. The book is aimed at readers who know programming but for whom the Python language is new.  This book is designed so that you can use it to quickly become proficient in Python. However, it provides more than just a beginners tutorial. Even once you've become more experienced, it should continue to be quite valuable to you as an indexed cache of information on the bulk of the Python concepts and constructs of which you will find yourself wanting to refresh or augment your knowledge.    It first covers the core features of Python (syntax, control flow, basic data structures, etc.) and provides the knowledge to write basic but useful scripts. Features in Python common to other languages are covered very concisely, while features unique to Python are explained in detail.    It next discusses Python features which would be useful to anyone using Python in larger applications, including facilities for managing large collections of code, object-oriented programming, advanced string handling, etc.    The last section of the book discusses advanced topics: Windows/COM programming with Python, integrating Python and Java (Python is one of the few languages other than Java which can be compiled into Java bytecode), extending the Python language with C, and an introduction to some of the advanced web site building tools that are available for Python.",PUBLISH,"daryl harms, kenneth mcdonald",python
Sharepoint 2010 Site Owner'S Manual,1933988754,300.0,2012-02-13 08:00:00+00:00,https://s3.amazonaws.com/AKIAJC5RLADLUMVRPFDQ.book-thumb-images/harryman.jpg,"""SharePoint 2010 Site Owner's Manual starts by assuming you already have SharePoint installed on your system and are looking for ways to solve the problems you face every day in your organization. You'll learn to determine what type of SharePoint installation you have   Microsoft Office SharePoint Server (MOSS), Windows SharePoint Services (WSS), the """"Fabulous 40"""" templates   and what features are at your disposal. Once you know the lay of the land", you'll discover what you can do yourself,desconocido,"and when you should leave it to the developers.""","""for every sharepoint 2010 developer who spends the day buried in visual studio cranking out code, there are dozens of other sharepoint site owners who want to share information, create content portals, and add features to existing sharepoint sites. if you're one of these sharepoint administrators, this is the book for you. chock-full of great ideas and scenarios you'll relate to immediately, this book will teach you the amazing things you can do with sharepoint 2010 without writing any code or calling in the developers. sharepoint 2010 site owner's manual starts by assuming you already have sharepoint installed on your system and are looking for ways to solve the problems you face every day in your organization. you'll learn to determine what type of sharepoint installation you have microsoft office sharepoint server (moss), windows sharepoint services (wss), the """"fabulous 40"""" templates and what features are at your disposal. once you know the lay of the land"
Java Development With Ant,1930110588,672.0,2002-08-01 07:00:00+00:00,https://s3.amazonaws.com/AKIAJC5RLADLUMVRPFDQ.book-thumb-images/hatcher.jpg,"The most widely used build tool for Java projects, Ant is cross-platform, extensible, simple, and fast. It scales from small personal projects to large, multi-team J2EE projects. And, most important, it's easy to learn.","Java Development with Ant systematically explores what Ant can do, and how to apply it to your project. Whether you are new to Ant, or an experienced user, this book will show you powerful and creative uses for Ant. The book emphasizes basic concepts you need to know to effectively use Ant starting with Ant's XML-driven build process. It leads you step-by-step through everything you need to know to compile, test, package and deploy an application. It then guides you through the maze of more complex situations common in larger projects such as enterprise Java applications and Web Services. With this book you will gain access to a powerful tool to automatically build, test and deploy your Java software, no matter how simple or complex it might be.",PUBLISH,"erik hatcher, steve loughran","java, internet"
Lucene In Action,1932394281,456.0,2004-12-01 08:00:00+00:00,https://s3.amazonaws.com/AKIAJC5RLADLUMVRPFDQ.book-thumb-images/hatcher2.jpg,No description available,"Lucene is a gem in the open-source world--a highly scalable, fast search engine. It delivers performance and is disarmingly easy to use. Lucene in Action is the authoritative guide to Lucene. It describes how to index your data, including types you definitely need to know such as MS Word, PDF, HTML, and XML. It introduces you to searching, sorting, filtering, and highlighting search results.    Lucene powers search in surprising places--in discussion groups at Fortune 100 companies, in commercial issue trackers, in email search from Microsoft, in the Nutch web search engine (that scales to billions of pages). It is used by diverse companies including Akamai, Overture, Technorati, HotJobs, Epiphany, FedEx, Mayo Clinic, MIT, New Scientist Magazine, and many others.    Adding search to your application can be easy. With many reusable examples and good advice on best practices, Lucene in Action shows you how. And if you would like to search through Lucene in Action over the Web, you can do so using Lucene itself as the search engine--take a look at the authors' awesome Search Inside solution. Its results page resembles Google's and provides a novel yet familiar interface to the entire book and book blog.",PUBLISH,"erik hatcher, otis gospodnetic",java
"Lucene In Action, Second Edition",1933988177,532.0,2010-07-09 07:00:00+00:00,https://s3.amazonaws.com/AKIAJC5RLADLUMVRPFDQ.book-thumb-images/hatcher3.jpg,"With clear writing, reusable examples, and unmatched advice on best practices, Lucene in Action is still the definitive guide to developing with Lucene.","""When Lucene first hit the scene five years ago, it was nothing short of amazing. By using this open-source, highly scalable, super-fast search engine, developers could integrate search into applications quickly and efficiently. A lot has changed since then   search has grown from a """"nice-to-have"""" feature into an indispensable part of most enterprise applications. Lucene now powers search in diverse companies including Akamai",desconocido,linkedin,technorati
Powerbuilder 6.0 Questions & Answers,1884777708,446.0,1998-07-01 07:00:00+00:00,https://s3.amazonaws.com/AKIAJC5RLADLUMVRPFDQ.book-thumb-images/hatton.jpg,"""If you'd like to learn PowerBuilder--or enhance your skills-- this book is for you. Its hands-on approach will show you how to write real code. Each section takes a specific """"How do I """" topic and answers commonly asked questions in an easy-to-understand"," conversational manner. It then shows you how the same technique can be used over and over again to decrease your overall code-writing time.""",desconocido,"conversational manner. it then shows you how the same technique can be used over and over again to decrease your overall code-writing time.""",publish
The Awesome Power Of Powerj,1884777538,378.0,1998-05-01 07:00:00+00:00,https://s3.amazonaws.com/AKIAJC5RLADLUMVRPFDQ.book-thumb-images/hatton2.jpg,"The Awesome Power of PowerJ shows you how you can write Java programs the very first day with PowerJ, even if you don't know Java. Through a hands-on approach that makes liberal use of figures and code snippets, you will learn how to use PowerJ to build effective Java applets and applications.","PowerJ is the bridge between the rapid application development world of PowerBuilder and the multiplatform world of Java. The Awesome Power of PowerJ shows you how you can write Java programs the very first day with PowerJ, even if you don't know Java. Through a hands-on approach that makes liberal use of figures and code snippets, you will learn how to use PowerJ to build effective Java applets and applications.",PUBLISH,tim hatton,java
The Awesome Power Of Power++,1884777546,416.0,1998-06-01 07:00:00+00:00,https://s3.amazonaws.com/AKIAJC5RLADLUMVRPFDQ.book-thumb-images/hatton3.jpg,The Awesome Power of Power++ is for the beginning to intermediate Power++ programmer. It assumes that you have little or no knowledge of the C++ language but that you do know programming constructs. The purpose is to teach you how to use Power++ to build C++ applets and applications even if you are not a C++ expert. To this end it takes a hands-on approach and makes liberal use of figures and code snippets.,The Awesome Power of Power++ is for the beginning to intermediate Power++ programmer. It assumes that you have little or no knowledge of the C++ language but that you do know programming constructs. The purpose is to teach you how to use Power++ to build C++ applets and applications even if you are not a C++ expert. To this end it takes a hands-on approach and makes liberal use of figures and code snippets.    The Awesome Power of Power++ is for:    * IS Managers who are investigating C++ and C++ environments  * Developers who are wanting to learn C++ and build C++ programs  * Any developer who has a C++ project that must be finished quickly ,PUBLISH,tim hatton,powerbuilder
Azure In Action,193518248X,425.0,2010-10-22 07:00:00+00:00,https://s3.amazonaws.com/AKIAJC5RLADLUMVRPFDQ.book-thumb-images/hay.jpg,"Azure in Action is a fast-paced tutorial intended for architects and developers looking to develop on Windows Azure and the Windows Azure Platform. It's designed both for readers new to cloud concepts and for those familiar with cloud development but new to Azure. After a quick walk through the basics, it guides you all the way from your first app through more advanced concepts of the Windows Azure Platform.","""Cloud-based applications pose an intriguing value proposition for businesses. With an easily scalable, pay-as-you-go model and very small startup costs, the cloud can be a great alternative to systems hosted in-house. Developers are scrambling to understand the impact a cloud-based approach will have on current and future projects.    Azure is Microsoft's full-fledged entry into the """"Cloud Services Platform"""" arena. Unlike other cloud offerings that address only one piece of the puzzle",desconocido,a set of developer services,and a data model that can be used individually or together. it's designed to interact seamlessly with other .net-based components
Distributed Agile In Action,1935182412,325.0,desconocido,https://s3.amazonaws.com/AKIAJC5RLADLUMVRPFDQ.book-thumb-images/hazrati.jpg,"Distributed Agile in Action is the first book to directly address the unique task of going Agile in a distributed team. Rather than rehashing Agile theories, this book supplies the practical examples and step by step advice you need to help your distributed teams adopt and embrace Agile principles. It's a distilled and carefully organized learning aid for working in a distributed Agile environment, with in-depth focus on how to approach three critical components of development-People, Process and Technology.","As organizations try to do more with less, development teams are less likely to be centrally located, tightly-managed, and permanent. Distributed organizations face special challenges when implementing Agile processes, which rely on frequent communication and responsive teams. Distributed Agile in Action is a guide to running successful Agile projects within geographically and culturally diverse organizations.    Distributed Agile in Action is the first book to directly address the unique task of going Agile in a distributed team. Rather than rehashing Agile theories, this book supplies the practical examples and step by step advice you need to help your distributed teams adopt and embrace Agile principles. It's a distilled and carefully organized learning aid for working in a distributed Agile environment, with in-depth focus on how to approach three critical components of development-People, Process and Technology.    It's jam-packed with suggestions and stories gained from the authors' distributed Agile journey working with teams spread across cultures, continents, and time zones. The book includes a complete case study presenting an increasingly-common project scenario.    This book is written for developers and project managers in distributed teams. Although the examples and case study are presented in Java / Java EE, best practices from rest of the book are technology agnostic and would work equally well for any environment.",MEAP,"vikas hazrati, balaji d loganathan",software engineering
Metaprogramming In .Net,1617290262,0.0,2012-12-31 08:00:00+00:00,https://s3.amazonaws.com/AKIAJC5RLADLUMVRPFDQ.book-thumb-images/hazzard.jpg,No description available,No description available,PUBLISH,"kevin hazzard, jason bock",microsoft/.net
Portlets And Apache Portals,No ISBN,500.0,2005-10-01 07:00:00+00:00,https://s3.amazonaws.com/AKIAJC5RLADLUMVRPFDQ.book-thumb-images/hepper.jpg,"""Portlets and Apache Portals was not published by Manning, but the manuscript is available for download from our website """"as is.""""""","""Due to the growing complexity of web sites, portals and portlets are experiencing serious growth. Portals help reduce complexity by allowing the dynamic aggregation and display of diverse content in a single web page. Portal components are pluggable parts called portlets. To be """"pluggable"""" portlets and portals must satisfy standards. The authors of this book",desconocido,created these standards: java portlet specification jsr 168 and web services for remote portlets (wsrp). the book starts gently with the basics of portlet technology and a functionrich portlet example. it then dives more deeply into portlets and j2ee,portlet architecture
Code Generation In Action,1930110979,350.0,2003-07-01 07:00:00+00:00,https://s3.amazonaws.com/AKIAJC5RLADLUMVRPFDQ.book-thumb-images/herrington.jpg,"Code Generation In Action covers building database access, user interface, remote procedure, test cases, and business logic code as well as code for other key system functions.","Code Generation In Action covers technique and implementation for building high-quality machine-generated code for today's complex applications frameworks. The book includes step-by-step instruction for building dozens of code generators of varying types. These generators build high-quality output that is consistent and maintainable. Code generation abstracts the design of the code so that multiple outputs can be created from a single model of the application functionality, which means development teams can focus on higher-level design work and strategic problems, while still meeting goals for maintaining production applications.. The book covers techniques that range from simple code processors that handle common coding problems to more elaborate and complex generators that maintain entire application tiers.  Code Generation In Action covers building database access, user interface, remote procedure, test cases, and business logic code as well as code for other key system functions.    Although code generation is an engineering technique it also has a large impact on the engineering team and management. The book discusses the non-technical justifications for code generation in depth, and offers practical advice for making code generation succeed in any organization.",PUBLISH,jack herrington,programming
Illustrated Guide To Http,138582262,400.0,1997-03-01 08:00:00+00:00,https://s3.amazonaws.com/AKIAJC5RLADLUMVRPFDQ.book-thumb-images/hethmon.jpg,No description available,"If you're interested in building a web server -- or if you're developing an application that depends or will depend on current HTTP protocols -- Illustrated Guide to HTTP is for you! It covers the latest HTTP/1.1 protocol standard as found in RFC 2068 and RFC 2069. Any programmer, developer or web manager involved in web-related software needs this book to keep up with this dynamic area.",PUBLISH,paul s. hethmon,internet
Agile Alm,1935182633,0.0,2011-08-20 07:00:00+00:00,https://s3.amazonaws.com/AKIAJC5RLADLUMVRPFDQ.book-thumb-images/huettermann.jpg,"Many software projects fail unnecessarily because of unclear objectives, redundant and unproductive work, cost overruns, and a host of other avoidable process problems. In response, agile processes and lightweight tooling have begun to replace traditional engineering processes throughout the development lifecycle. An agile approach to application lifecycle management improves product quality, reduces time to market, and makes for happier developers.    Agile ALM is a guide for Java developers who want to integrate flexible agile practices and lightweight tooling along all phases of the software development process. The book introduces a new vision for managing change in requirements and process more efficiently and flexibly. You'll learn powerful practices like task-based Development, where you align activities into tasks resulting in traceable artifacts, Continuous Integration, in which you frequently and systematically integrate, build, and test an application in development and using Scrum as an agile approach to release management. The effect is a more comprehensive and practical approach to build, configuration, deployment, release, test, quality, integration, and requirements management.    This book synthesizes technical and functional elements to provide a comprehensive approach to software development. You'll learn to see the whole scope of the development process as a set of defined tasks, many of which are repeated daily, and then master the tools and practices you need to accomplish each of those tasks efficiently.    Because efficient tool chains can radically improve the speed and fluidity of the development process, this book demonstrates how to integrate state-of-the-art lightweight tools. Many of the tools and examples are Java-based, but the Agile ALM principles apply to all development platforms. As well, the many examples show how you can bridge different languages and systems.","Many software projects fail unnecessarily because of unclear objectives, redundant and unproductive work, cost overruns, and a host of other avoidable process problems. In response, agile processes and lightweight tooling have begun to replace traditional engineering processes throughout the development lifecycle. An agile approach to application lifecycle management improves product quality, reduces time to market, and makes for happier developers.    Agile ALM is a guide for Java developers who want to integrate flexible agile practices and lightweight tooling along all phases of the software development process. The book introduces a new vision for managing change in requirements and process more efficiently and flexibly. You'll learn powerful practices like task-based Development, where you align activities into tasks resulting in traceable artifacts, Continuous Integration, in which you frequently and systematically integrate, build, and test an application in development and using Scrum as an agile approach to release management. The effect is a more comprehensive and practical approach to build, configuration, deployment, release, test, quality, integration, and requirements management.    This book synthesizes technical and functional elements to provide a comprehensive approach to software development. You'll learn to see the whole scope of the development process as a set of defined tasks, many of which are repeated daily, and then master the tools and practices you need to accomplish each of those tasks efficiently.    Because efficient tool chains can radically improve the speed and fluidity of the development process, this book demonstrates how to integrate state-of-the-art lightweight tools. Many of the tools and examples are Java-based, but the Agile ALM principles apply to all development platforms. As well, the many examples show how you can bridge different languages and systems.",PUBLISH,michael httermann,software engineering
